{"analysisPolicyHash":"4e81843340041da45a13ebb742a0c5fdfebdf6c8f5e64a7d6629f58990b287a4","denominatorChurn":"1058","developerIdHash":"eaed488dac37a20eeadce46717abb4d78655633b3ffd07af79d532c4ce47185a","evidenceArtifactHash":"a41205eff782ce4af65f345e0afb97f16fd8677af215c7bdd06f460ce9602272","evidenceManifestHash":"df9e35adde01937b12da29eb21a3135268705d84168f9f1159a086b769d583ec","fromCommitHash":"a5ff7ac3bbb8659e2ec3ed41dd43889f06a7d7bc","metricId":"M4_DEVELOPER_CHURN_SHARE","metricValuePpm":307183,"metricVersion":"1.0.0","numeratorChurn":"325","policyId":"M4_DEVELOPER_CHURN_SHARE_POLICY","policyVersion":"1.0.0","projectId":"urllib3","schemaId":"M4_LEDGER_SUBMISSION","schemaVersion":"1.0.0","storagePersistence":"LOCAL_POC","storageReference":"artifacts/urllib3_W03.git.bundle","toCommitHash":"aaab4eccc10c965897540b21e15f11859d0b62e7","windowId":"urllib3_W03"}